{
  "$schema": "../../schemas/autonomous-seo-expansion-program.schema.json",
  "schema_version": "1.0.0",
  "program_id": "autonomous-seo-expansion",
  "objective": "Evolve WCSEO from an evidence-governed SEO diagnosis and orchestration system into a persistent, evidence-governed, self-improving SEO operations system that can progress selected capabilities through read-only, shadow, draft-write, canary-write, and bounded-autonomous maturity without weakening existing product, evidence, security, review, rollback, or claim boundaries.",
  "baseline": {
    "commit": "c2252947a35606d70c01416975e38f668ce24c8b",
    "branch": "main",
    "working_branch": "agent/autonomous-seo-expansion-p0",
    "captured_at": "2026-08-10T15:57:00Z"
  },
  "apivr_tier": "COMPREHENSIVE",
  "approval_model": "FOUNDER_CONTROLLED",
  "current_phase": "P0",
  "direct_merge_permitted": false,
  "capability_maturity_order": [
    "G0_DOCUMENTED",
    "G1_FIXTURE_VERIFIED",
    "G2_SHADOW_VERIFIED",
    "G3_LIVE_READ_VERIFIED",
    "G4_DRAFT_WRITE_VERIFIED",
    "G5_CANARY_WRITE_VERIFIED",
    "G6_BOUNDED_AUTONOMOUS"
  ],
  "phase_close_requires": [
    "exact source baseline recorded",
    "planned versus actual implementation audit completed",
    "focused and impacted regression tests pass",
    "repository and schema validators pass",
    "security and adverse-state checks pass where applicable",
    "rollback or safe containment is demonstrated",
    "Founder approval is recorded against the exact non-write phase and its verification evidence",
    "Every external write remains separately approval-gated",
    "technical verification is complete",
    "outcome verification is recorded as PASS, PENDING, or NOT_RUN only when the horizon is not yet observable",
    "phase re-audit is complete"
  ],
  "scope": [
    "persistent site identity, Brand Truth, site state, action, outcome, hypothesis, and experiment contracts",
    "provider-neutral SEO intelligence and governed live-read provider integrations",
    "SERP forensic intelligence, information architecture, internal linking, opportunity scoring, content rescue, and mission planning",
    "R&D, attribution, site-local learning, and evidence-governed rule promotion",
    "write-safety contracts, draft/staging integrations, production canaries, and bounded autonomous action classes",
    "independent Local/GBP, GEO/AIO, authority, and social-distribution extension lanes"
  ],
  "exclusions": [
    "changing the current read-only flagship audit into an autonomous write command",
    "claiming provider, ranking, traffic, conversion, AI-citation, local-pack, or revenue outcomes without the required live or operational evidence",
    "PBNs, manipulative paid links, automated reciprocal-link schemes, cloaking, fake reviews, fake locations, parasite abuse, fake community conversations, or other search spam",
    "a global autonomy switch that permits unreviewed write classes to skip individual maturity gates"
  ],
  "phases": [
    {
      "id": "P0",
      "title": "Authority, baseline, and expansion contract",
      "status": "BLOCKED",
      "apivr_tier": "COMPREHENSIVE",
      "objective": "Establish one machine-validated expansion program anchored to the current repository authority without changing the flagship product proof boundary or permitting direct merge.",
      "depends_on": [],
      "owners": {
        "lead": "Runtime architecture owner",
        "scrummaster": "Senior ScrumMaster 3",
        "independent_reviewer": "VP Engineering"
      },
      "scope": [
        "canonical expansion program",
        "phase order and maturity gates",
        "APIVR and reviewer requirements",
        "repository validation integration"
      ],
      "non_goals": [
        "feature implementation",
        "provider calls",
        "external writes",
        "main-branch mutation outside the approved PR process"
      ],
      "maturity_target": "G0_DOCUMENTED",
      "acceptance_criteria": [
        "The program is schema-valid and rejects phase skipping, multiple active phases, direct merge, premature write maturity, and missing safety controls.",
        "The repository validator executes the autonomous expansion validator and mutation tests cover material program bypasses.",
        "Existing owner-controlled remediation, product contract, command authority, and capability authority remain canonical and unweakened."
      ],
      "rollback": "Revert the Phase 0 schema, program, validator, tests, ledger, and repository-validator hook as one bounded PR if any existing governance or validation behavior regresses.",
      "stop_conditions": [
        "Current repository authority cannot be resolved unambiguously.",
        "The new program requires weakening an existing product, security, evidence, reviewer, or rollback gate.",
        "Repository validation cannot run the new control without breaking existing validation semantics."
      ],
      "technical_verification": "PASS",
      "outcome_verification": "NOT_REQUIRED"
    },
    {
      "id": "P1",
      "title": "Site profile and Brand Truth contracts",
      "status": "NOT_STARTED",
      "apivr_tier": "COMPREHENSIVE",
      "objective": "Create evidence-governed site identity, Brand Truth, site-state, action, outcome, hypothesis, and experiment contracts before introducing persistent behavior.",
      "depends_on": ["P0"],
      "owners": {
        "lead": "Data architecture owner",
        "scrummaster": "Senior ScrumMaster 3",
        "independent_reviewer": "VP Engineering"
      },
      "scope": ["site identity schema", "Brand Truth provenance", "action and outcome contracts", "hypothesis and experiment contracts"],
      "non_goals": ["provider execution", "persistent storage implementation", "public content generation"],
      "maturity_target": "G1_FIXTURE_VERIFIED",
      "acceptance_criteria": [
        "Schemas reject malformed, duplicate, contradictory, stale, unsupported-public, and sensitive-leakage fixtures where applicable.",
        "Every public-use Brand Truth fact has explicit provenance, state, review timing, and use permission."
      ],
      "rollback": "Revert the new contracts and fixtures without altering existing session-state or runtime contracts.",
      "stop_conditions": ["A proposed field duplicates an existing canonical contract without a justified extension path.", "Sensitive-data handling cannot be expressed without weakening current redaction rules."],
      "technical_verification": "NOT_RUN",
      "outcome_verification": "NOT_RUN"
    },
    {
      "id": "P2",
      "title": "Persistent site state, action ledger, and outcome store",
      "status": "NOT_STARTED",
      "apivr_tier": "COMPREHENSIVE",
      "objective": "Implement bounded persistent site-level memory for approved evidence references, active experiments, actions, outcomes, and risks without replacing session state or persisting secrets.",
      "depends_on": ["P1"],
      "owners": {
        "lead": "Runtime architecture owner",
        "scrummaster": "Senior ScrumMaster 3",
        "independent_reviewer": "VP Engineering"
      },
      "scope": ["site state store", "action ledger", "outcome store", "redaction", "retention and version boundaries"],
      "non_goals": ["provider collection", "production writes", "causal claims"],
      "maturity_target": "G1_FIXTURE_VERIFIED",
      "acceptance_criteria": [
        "Atomicity, corruption handling, concurrency, redaction, retention, deletion, and schema-version boundaries are fixture verified.",
        "Secrets and unnecessary personal data cannot enter persisted site state through supported write paths."
      ],
      "rollback": "Disable the new site-level persistence and revert its modules while leaving existing runtime session memory unchanged.",
      "stop_conditions": ["Atomic or recoverable persistence cannot be demonstrated.", "The implementation requires storing secrets or uncontrolled raw provider payloads."],
      "technical_verification": "NOT_RUN",
      "outcome_verification": "NOT_RUN"
    },
    {
      "id": "P3",
      "title": "Provider-neutral SEO intelligence contracts",
      "status": "NOT_STARTED",
      "apivr_tier": "COMPREHENSIVE",
      "objective": "Define provider-neutral read contracts for SERP, keyword, rendered content, rank, backlink, local maps, and AI visibility evidence while preserving provider semantics and cost provenance.",
      "depends_on": ["P2"],
      "owners": {
        "lead": "Provider integrations owner",
        "scrummaster": "Senior ScrumMaster 3",
        "independent_reviewer": "VP Engineering"
      },
      "scope": ["provider result interfaces", "normalization", "coverage states", "cost and provenance metadata", "failure semantics"],
      "non_goals": ["credentialed provider calls", "provider-specific scoring normalization", "external writes"],
      "maturity_target": "G1_FIXTURE_VERIFIED",
      "acceptance_criteria": [
        "Fixtures cover empty, partial, stale, malformed, timeout, rate-limit, pagination, unsupported-market, cost-ceiling, and unavailable-provider states.",
        "Provider-specific metrics retain their native semantics unless equivalence is proven."
      ],
      "rollback": "Revert new provider-neutral interfaces before any provider implementation depends on them.",
      "stop_conditions": ["The abstraction erases provider-specific semantics required for truthful downstream decisions.", "The contract bypasses existing AdapterResult or runtime tool governance without an approved architecture change."],
      "technical_verification": "NOT_RUN",
      "outcome_verification": "NOT_RUN"
    },
    {
      "id": "P4",
      "title": "DataForSEO and rendered-content acquisition",
      "status": "NOT_STARTED",
      "apivr_tier": "COMPREHENSIVE",